Team_name,Team_description,organization_name,Team_member_list,create_by,create_dt,update_by,update_dt
None,None,digimonk,,Shubham,2020-03-12 09:06:33.143461+00:00,Shubham,2020-03-12 09:06:33.143474+00:00
Team-T1 (example),Agile teams build software products.,digimonk,,Shubham,2020-02-21 07:16:17.705074+00:00,Shubham,2020-02-21 07:16:17.705082+00:00
FlexTeam (example),This vendor provided team supplements all existing teams,digimonk,,Shubham,2020-02-21 07:20:58.849623+00:00,Shubham,2020-02-21 07:20:58.849628+00:00
Ticket Masters Kanban (example),This team handles all production support tickets for all business units. This is a Kanban Team.,digimonk,,Shubham,2020-02-21 07:21:26.179250+00:00,Shubham,2020-02-21 07:21:26.179255+00:00
Mechanic Masters (example),This team implements key strategic initiatives,digimonk,,Shubham,2020-02-21 07:21:48.049098+00:00,Shubham,2020-02-21 07:21:48.049103+00:00
Team-T2 (example),"In Agile Ready, one or more teams work to build software products which have capabilities and features.",digimonk,,Shubham,2020-03-12 09:51:53.868563+00:00,Shubham,2020-03-12 09:51:53.868569+00:00
